Sheet: offer_stats
A1: Merchant | B1: Title | C1: Start | D1: End | E1: Views | F1: Favorites | G1: Ratings | H1: Redemptions | I1: Redemption %
A2: Cafe Donuts | B2: $2 Off One Dozen Donuts | C2: 05/07/2014 | D2: 05/23/2014 | E2: 71 | F2: 5 | G2: 9 | H2: 10 | I2: =RC[-1]/RC[-4] -> 0.14084507042253522
A3: Caribou Coffee | B3: $1 Off Your Order | C3: 05/05/2014 | D3: 05/09/2014 | E3: 19 | F3: 2 | G3: 3 | H3: 3 | I3: =RC[-1]/RC[-4] -> 0.15789473684210525
A4: Caribou Coffee | B4: Buy-One-Get-One at Caribou Coffee | C4: 05/12/2014 | D4: 05/17/2014 | E4: 74 | F4: 1 | G4: 8 | H4: 13 | I4: =RC[-1]/RC[-4] -> 0.17567567567567569
A5: Caribou Coffee | B5: $2 Medium Beverage at Caribou | C5: 05/19/2014 | D5: 05/24/2014 | E5: 87 | F5: 3 | G5: 10 | H5: 35 | I5: =RC[-1]/RC[-4] -> 0.40229885057471265
A6: Caribou Coffee | B6: Free Brewed Coffee! | C6: 05/26/2014 | D6: 05/28/2014 | E6: 39 | F6: 1 | G6: 10 | H6: 6 | I6: =RC[-1]/RC[-4] -> 0.15384615384615385
A7: Caribou Coffee | B7: $1 Off Your Order | C7: 05/29/2014 | D7: 05/31/2014 | E7: 35 | F7: 2 | G7: 13 | H7: 10 | I7: =RC[-1]/RC[-4] -> 0.2857142857142857
A8: Caribou Coffee | B8: $2 Medium Beverage at Caribou | C8: 06/02/2014 | D8: 06/08/2014 | E8: 94 | F8: 5 | G8: 26 | H8: 16 | I8: =RC[-1]/RC[-4] -> 0.1702127659574468
A9: Caribou Coffee | B9: Buy-One-Get-One at Caribou Coffee | C9: 06/09/2014 | D9: 06/15/2014 | E9: 69 | F9: 1 | G9: 16 | H9: 19 | I9: =RC[-1]/RC[-4] -> 0.27536231884057971
A10: Caribou Coffee | B10: Free Brewed Coffee! | C10: 06/16/2014 | D10: 06/22/2014 | E10: 88 | F10: 5 | G10: 20 | H10: 27 | I10: =RC[-1]/RC[-4] -> 0.30681818181818182
A11: Caribou Coffee | B11: $2 Medium Beverage at Caribou | C11: 06/23/2014 | D11: 06/29/2014 | E11: 4 | F11: 0 | G11: 1 | H11: 3 | I11: =RC[-1]/RC[-4] -> 0.75
A12: Caribou Coffee | B12: $1 Off Your Order | C12: 06/30/2014 | D12: 07/06/2014 | E12: 0 | F12: 0 | G12: 0 | H12: 0 | I12: =RC[-1]/RC[-4] -> #DIV/0!
A13: Cousin Subs | B13: Free Drink with Sub Purchase | C13: 05/06/2014 | D13: 05/07/2014 | E13: 0 | F13: 0 | G13: 0 | H13: 0 | I13: =RC[-1]/RC[-4] -> #DIV/0!
A14: Cousin Subs | B14: Free Drink with Sub Purchase | C14: 05/06/2014 | D14: 05/16/2014 | E14: 23 | F14: 0 | G14: 2 | H14: 0 | I14: =RC[-1]/RC[-4] -> 0
A15: Cousin Subs | B15: $1 off sub | C15: 06/08/2014 | D15: 06/30/2014 | E15: 45 | F15: 2 | G15: 14 | H15: 2 | I15: =RC[-1]/RC[-4] -> 4.4444444444444446E-2
A16: DQ / OJ | B16: Buy One Get One Smoothie / Orange Julius | C16: 05/07/2014 | D16: 05/25/2014 | E16: 51 | F16: 0 | G16: 5 | H16: 2 | I16: =RC[-1]/RC[-4] -> 3.9215686274509803E-2
A17: DQ / OJ | B17: Buy One Get One Smoothie / Orange Julius | C17: 06/09/2014 | D17: 06/30/2014 | E17: 65 | F17: 2 | G17: 14 | H17: 4 | I17: =RC[-1]/RC[-4] -> 6.1538461538461542E-2
A18: Health Source Chiropractic | B18: Massage Special | C18: 05/08/2014 | D18: 05/09/2014 | E18: 0 | F18: 0 | G18: 0 | H18: 0 | I18: =RC[-1]/RC[-4] -> #DIV/0!
A19: Health Source Chiropractic | B19: $15 / 30 minute massage | C19: 06/09/2014 | D19: 06/30/2014 | E19: 59 | F19: 0 | G19: 14 | H19: 3 | I19: =RC[-1]/RC[-4] -> 5.0847457627118647E-2
A20: Mama's Pizza | B20: Morning Special | C20: 05/07/2014 | D20: 06/06/2014 | E20: 137 | F20: 1 | G20: 17 | H20: 3 | I20: =RC[-1]/RC[-4] -> 2.1897810218978103E-2
A21: Moss Optical | B21: $20 off Ray-Ban Sunglasses | C21: 05/13/2014 | D21: 05/30/2014 | E21: 26 | F21: 0 | G21: 5 | H21: 2 | I21: =RC[-1]/RC[-4] -> 7.6923076923076927E-2
A22: Murph Dog | B22: $4 meal special! | C22: 06/09/2014 | D22: 06/30/2014 | E22: 72 | F22: 1 | G22: 11 | H22: 2 | I22: =RC[-1]/RC[-4] -> 2.7777777777777776E-2
A23: Sawatdee | B23: Sawatdee Lunch Buffet | C23: 05/07/2014 | D23: 05/23/2014 | E23: 63 | F23: 1 | G23: 2 | H23: 0 | I23: =RC[-1]/RC[-4] -> 0
A24: Sawatdee | B24: Sawatdee Lunch Buffet | C24: 06/08/2014 | D24: 06/30/2014 | E24: 67 | F24: 4 | G24: 14 | H24: 2 | I24: =RC[-1]/RC[-4] -> 2.9850746268656716E-2
A25: SkyBites | B25: $2 Off Salads | C25: 05/07/2014 | D25: 05/30/2014 | E25: 62 | F25: 1 | G25: 8 | H25: 4 | I25: =RC[-1]/RC[-4] -> 6.4516129032258063E-2
A26: Take Care Chiropractic | B26: Free 30 Min Massage with a New Patient Consult | C26: 05/21/2014 | D26: 05/30/2014 | E26: 25 | F26: 1 | G26: 3 | H26: 1 | I26: =RC[-1]/RC[-4] -> 0.04
A27: The Northern Lights Tea Company | B27: 20% Merchandise | C27: 05/10/2014 | D27: 05/30/2014 | E27: 47 | F27: 3 | G27: 7 | H27: 3 | I27: =RC[-1]/RC[-4] -> 6.3829787234042548E-2
A28: The Northern Lights Tea Company | B28: 25% off Hari Ghatta | C28: 06/11/2014 | D28: 06/30/2014 | E28: 15 | F28: 0 | G28: 5 | H28: 2 | I28: =RC[-1]/RC[-4] -> 0.13333333333333333
A29: Wuollet Bakery | B29: Free Coffee with Purchase | C29: 05/15/2014 | D29: 06/27/2014 | E29: 116 | F29: 3 | G29: 32 | H29: 18 | I29: =RC[-1]/RC[-4] -> 0.15517241379310345